{
  "artifacts": [
    {
      "description": "synthetic",
      "media_type": "application/octet-stream",
      "uri": "evidence/EV-GC-HUMAN.bin"
    }
  ],
  "created_at": "2026-03-01T10:00:00Z",
  "evidence_id": "EV-GC-HUMAN",
  "limitations": [
    "Synthetic record for validator tests"
  ],
  "provenance": {
    "capture_context": "HUMAN_RECORD",
    "subject_revision": "build-7"
  },
  "schema_version": "1.0",
  "source": {
    "id": "creative-lead",
    "kind": "HUMAN"
  },
  "subject": {
    "kind": "GOLDEN_CELL",
    "ref": "cell-1"
  },
  "summary": "Synthetic HUMAN_EVIDENCE for cell-1.",
  "superseded": false,
  "type": "HUMAN_EVIDENCE"
}
