{
  "artifacts": [
    {
      "description": "synthetic",
      "media_type": "application/octet-stream",
      "uri": "evidence/EV-DASH-MOTION.bin"
    }
  ],
  "created_at": "2026-03-01T10:00:00Z",
  "evidence_id": "EV-DASH-MOTION",
  "limitations": [
    "Synthetic record for validator tests"
  ],
  "provenance": {
    "build_id": "build-rev-dash-3",
    "capture_context": "DIAGNOSTIC_RUNTIME",
    "subject_revision": "rev-dash-3"
  },
  "schema_version": "1.0",
  "source": {
    "id": "gameplay-design",
    "kind": "AGENT"
  },
  "subject": {
    "kind": "FEATURE",
    "ref": "dash"
  },
  "summary": "Synthetic MOTION_EVIDENCE for dash.",
  "superseded": false,
  "type": "MOTION_EVIDENCE"
}
