{
  "artifacts": [
    {
      "description": "synthetic",
      "media_type": "application/octet-stream",
      "uri": "evidence/EV-GC-FEEL.bin"
    }
  ],
  "created_at": "2026-03-01T10:00:00Z",
  "evidence_id": "EV-GC-FEEL",
  "limitations": [
    "Synthetic record for validator tests"
  ],
  "provenance": {
    "build_id": "build-build-7",
    "capture_context": "DIAGNOSTIC_RUNTIME",
    "subject_revision": "build-7"
  },
  "schema_version": "1.0",
  "source": {
    "id": "game-feel-vfx",
    "kind": "AGENT"
  },
  "subject": {
    "kind": "GOLDEN_CELL",
    "ref": "cell-1"
  },
  "summary": "Synthetic MOTION_EVIDENCE for cell-1.",
  "superseded": false,
  "type": "MOTION_EVIDENCE"
}
