{
  "artifacts": [
    {
      "description": "synthetic",
      "media_type": "application/octet-stream",
      "uri": "evidence/EV-GC-PERF.bin"
    }
  ],
  "created_at": "2026-03-01T10:00:00Z",
  "evidence_id": "EV-GC-PERF",
  "limitations": [
    "Synthetic record for validator tests"
  ],
  "provenance": {
    "build_id": "build-build-7",
    "capture_context": "PERFORMANCE_RUNTIME",
    "device": "Pixel-X",
    "instrumentation": {
      "description": "Sampling profiler",
      "present": true,
      "timing_impact": "NEGLIGIBLE"
    },
    "subject_revision": "build-7",
    "target_platform": "ANDROID"
  },
  "schema_version": "1.0",
  "source": {
    "id": "qa-performance",
    "kind": "AGENT"
  },
  "subject": {
    "kind": "GOLDEN_CELL",
    "ref": "cell-1"
  },
  "summary": "Synthetic PERFORMANCE_EVIDENCE for cell-1.",
  "superseded": false,
  "type": "PERFORMANCE_EVIDENCE"
}
